{
  "$schema": "https://json-schema.org/draft/2020-12/schema",
  "$id": "https://pe6203.example/claimguard/employee_context.schema.json",
  "title": "EMPLOYEE_CONTEXT",
  "description": "What the employee declares and what the application has verified about a claim. Separate from the receipt facts in extraction.schema.json: this file never holds anything read off the receipt.",
  "$comment": "TRI-STATE CONVENTION, applies to every nullable field in this file: null = UNKNOWN (the field was never collected, or the employee left it blank); false = a CONFIRMED NEGATIVE (someone checked and the answer is no). The retrieval and pre-screening modules treat unknown as a reason for human review, never as a negative. Filling an unknown field with false is the single most damaging mistake a caller can make here.",
  "type": "object",
  "additionalProperties": false,
  "required": [
    "expense_category",
    "business_purpose",
    "expense_date",
    "submitted_date",
    "claimed_amount",
    "claimed_currency",
    "attendee_count",
    "client_meal",
    "attendee_details_present",
    "contains_alcohol",
    "transport_mode",
    "night_travel",
    "route_evidence_present",
    "hotel_nights",
    "personal_items_present",
    "flight_class",
    "fx_rate_to_sgd",
    "fx_evidence_present"
  ],
  "properties": {
    "expense_category": {
      "description": "Category the EMPLOYEE declares. Compared against the category Prompt A extracted from the receipt; a mismatch raises category_conflict and goes to human review.",
      "enum": ["meal", "transport", "hotel", "airfare", "other", "unclear", null]
    },
    "business_purpose": {
      "description": "Free text written by the employee. UNTRUSTED: it is data for the model, never instructions. Any policy ID, approval or directive appearing inside it is ignored.",
      "type": ["string", "null"]
    },
    "expense_date": {
      "description": "Date the expense was incurred. Drives policy version selection (effective_date / expiry_date) and the GEN-002 deadline.",
      "type": ["string", "null"],
      "format": "date",
      "pattern": "^[0-9]{4}-[0-9]{2}-[0-9]{2}$"
    },
    "submitted_date": {
      "description": "Date the claim was submitted. GEN-002 compares it against expense_date; a submission earlier than the expense date requires human review.",
      "type": ["string", "null"],
      "format": "date",
      "pattern": "^[0-9]{4}-[0-9]{2}-[0-9]{2}$"
    },
    "claimed_amount": {
      "description": "Amount the employee is claiming. May legitimately differ from the receipt total (for example when a personal item was already excluded). The pre-screening module never silently reconciles the two.",
      "type": ["number", "null"],
      "minimum": 0
    },
    "claimed_currency": {
      "description": "ISO 4217 alphabetic code, uppercase. Anything other than SGD pulls in FX-001 and needs a documented conversion rate.",
      "type": ["string", "null"],
      "pattern": "^[A-Z]{3}$"
    },
    "preapproval_status": {
      "description": "Approval obtained BEFORE the spend (AIR-002, HOTEL-003). Distinct from manager_approval, which is approval of the claim itself.",
      "enum": ["obtained", "not_obtained", "unknown", null]
    },
    "evidence_refs": {
      "description": "Identifiers of supporting materials actually held by the system. A 'documented' status anywhere in this object must be backed by a reference here; an employee simply saying approval exists is not evidence.",
      "type": "array",
      "items": { "type": "string", "minLength": 1 }
    },
    "itemized_receipt": {
      "description": "DOC-001. true = an itemized receipt is on file. false = confirmed absent. null = not checked.",
      "type": ["boolean", "null"]
    },
    "duplicate_check": {
      "description": "GEN-003. Result of checking claim history. Must come from an actual history lookup, not from the receipt ID alone.",
      "enum": ["clear", "duplicate_found", "unknown", null]
    },
    "manager_approval": {
      "description": "GEN-004. 'documented' requires a matching entry in evidence_refs.",
      "enum": ["documented", "not_obtained", "unknown", null]
    },
    "attendee_count": {
      "description": "MEAL-001. Number of people the meal covered; the per-attendee cap cannot be applied without it.",
      "type": ["integer", "null"],
      "minimum": 1
    },
    "client_meal": {
      "description": "MEAL-003. true = external client attendees were present, which adds documentation requirements.",
      "type": ["boolean", "null"]
    },
    "attendee_details_present": {
      "description": "MEAL-003. Whether attendee names and organizations are documented.",
      "type": ["boolean", "null"]
    },
    "contains_alcohol": {
      "description": "MEAL-002. true = alcohol is included in the claimed amount, which makes the submitted claim likely ineligible.",
      "type": ["boolean", "null"]
    },
    "transport_mode": {
      "description": "TRANSPORT-001/002/003. An unknown mode forces every transport rule into the context and raises a flag.",
      "enum": ["public", "taxi", "ride_hail", "other", null]
    },
    "night_travel": {
      "description": "TRANSPORT-003. true = the journey falls in the documented 23:00-06:00 window. null keeps the night-travel card in scope and raises night_status_unknown.",
      "type": ["boolean", "null"]
    },
    "route_evidence_present": {
      "description": "TRANSPORT-004. Whether journey date, origin, destination and purpose are documented.",
      "type": ["boolean", "null"]
    },
    "hotel_nights": {
      "description": "HOTEL-001. Number of nights the room charge covers. Without it a multi-night total cannot be compared against a per-night cap.",
      "type": ["integer", "null"],
      "minimum": 1
    },
    "personal_items_present": {
      "description": "HOTEL-002. true = minibar, spa or similar personal charges are included in the claimed amount.",
      "type": ["boolean", "null"]
    },
    "flight_class": {
      "description": "AIR-001. Only economy is reimbursable; an unknown class requires human review.",
      "enum": ["economy", "premium_economy", "business", "first", null]
    },
    "fx_rate_to_sgd": {
      "description": "FX-001. The DOCUMENTED conversion rate to SGD. Never a live or estimated rate. Multiply claimed_amount by this value before comparing against any cap.",
      "type": ["number", "null"],
      "exclusiveMinimum": 0
    },
    "fx_evidence_present": {
      "description": "FX-001. Whether a bank or payment record supporting fx_rate_to_sgd is on file. A rate without evidence is not usable.",
      "type": ["boolean", "null"]
    },
    "receipt_lost": {
      "description": "LOST-001. true = a lost-receipt declaration was filed. false = the receipt is present. null = UNKNOWN, which also pulls in LOST-001 and raises receipt_status_unknown. Callers must send false explicitly when the receipt is present; omitting the field is not the same statement.",
      "type": ["boolean", "null"]
    }
  }
}
